{
  "name": "Z Code",
  "description": "AI coding agent. Details pending.",
  "homepage": null,
  "docs": "https://zcode.z.ai/en/docs/welcome",
  "github": null,
  "id": "z-code",
  "oss": false,
  "license": "unknown",
  "categories": [
    "coding"
  ],
  "interfaces": [
    "cli"
  ],
  "source": "openharnessai.app directory",
  "last_verified": null,
  "capabilities": {
    "sandbox": "unknown",
    "tools": "unknown",
    "mcp": "unknown",
    "permissions": "unknown",
    "resume": "unknown",
    "subagents": "unknown"
  }
}
