{
  "name": "nanobot",
  "description": "An ultra-lightweight personal AI agent.",
  "homepage": "https://github.com/HKUDS/nanobot",
  "docs": "https://github.com/HKUDS/nanobot",
  "github": "https://github.com/HKUDS/nanobot",
  "id": "nanobot",
  "oss": true,
  "license": "unknown",
  "categories": [
    "coding"
  ],
  "interfaces": [
    "cli"
  ],
  "source": "openharnessai.app directory",
  "last_verified": null,
  "capabilities": {
    "sandbox": "unknown",
    "tools": "unknown",
    "mcp": "unknown",
    "permissions": "unknown",
    "resume": "unknown",
    "subagents": "unknown"
  }
}
